[{
  "_id": {
    "$oid": "675317b90871166a067371ea"
  },
  "date": "6-12-2024",
  "winningNumbers": [
    10,
    3,
    8,
    6,
    9
  ],
  "createdAt": {
    "$date": "2024-12-06T15:26:49.006Z"
  },
  "angi": {
    "numbers": [
      1,
      2,
      3,
      4,
      5
    ],
    "entryDate": {
      "$date": "2024-12-06T15:54:04.385Z"
    }
  },
  "undefined": {
    "numbers": null,
    "entryDate": {
      "$date": "2024-12-06T21:33:39.087Z"
    }
  },
  "Angi": {
    "numbers": [
      10,
      6,
      2,
      7,
      9
    ],
    "entryDate": {
      "$date": "2024-12-06T21:36:43.649Z"
    }
  },
  "Bauschi": {
    "numbers": [
      9,
      10,
      7,
      2,
      3
    ],
    "entryDate": {
      "$date": "2024-12-06T22:26:21.759Z"
    }
  },
  "silvio": {
    "numbers": [
      3,
      7,
      6,
      9,
      5
    ],
    "entryDate": {
      "$date": "2024-12-06T22:31:20.686Z"
    }
  },
  "lorenz": {
    "numbers": [
      10,
      3,
      9,
      6,
      5
    ],
    "entryDate": {
      "$date": "2024-12-06T22:35:41.509Z"
    }
  }
},
{
  "_id": {
    "$oid": "6754486c76eb23f8e980225a"
  },
  "date": "7-12-2024",
  "winningNumbers": [
    10,
    7,
    6,
    2,
    3
  ],
  "createdAt": {
    "$date": "2024-12-07T13:06:52.512Z"
  },
  "Bauschi": {
    "numbers": [
      10,
      3,
      6,
      8,
      1
    ],
    "entryDate": {
      "$date": "2024-12-07T13:07:15.716Z"
    }
  },
  "Angi": {
    "numbers": [
      8,
      3,
      10,
      6,
      5
    ],
    "entryDate": {
      "$date": "2024-12-07T14:24:02.074Z"
    }
  }
},
{
  "_id": {
    "$oid": "675597cb5c9ec6cbbebc1d4f"
  },
  "date": "8-12-2024",
  "winningNumbers": [
    9,
    4,
    2,
    1,
    3
  ],
  "createdAt": {
    "$date": "2024-12-08T12:57:47.412Z"
  },
  "Bauschi": {
    "numbers": [
      2,
      6,
      3,
      8,
      10
    ],
    "entryDate": {
      "$date": "2024-12-08T16:34:35.577Z"
    }
  },
  "Angi": {
    "numbers": [
      2,
      3,
      9,
      4,
      6
    ],
    "entryDate": {
      "$date": "2024-12-08T16:54:10.496Z"
    }
  }
},
{
  "_id": {
    "$oid": "6756992f99600241382a152c"
  },
  "date": "9-12-2024",
  "winningNumbers": [
    1,
    2,
    6,
    8,
    4
  ],
  "createdAt": {
    "$date": "2024-12-09T07:15:59.021Z"
  },
  "Joel": {
    "numbers": [
      2,
      8,
      5,
      9,
      4
    ],
    "entryDate": {
      "$date": "2024-12-09T12:26:39.956Z"
    }
  },
  "Lars": {
    "numbers": [
      8,
      4,
      10,
      2,
      3
    ],
    "entryDate": {
      "$date": "2024-12-09T12:27:20.689Z"
    }
  },
  "Juls": {
    "numbers": [
      1,
      7,
      9,
      10,
      5
    ],
    "entryDate": {
      "$date": "2024-12-09T12:27:54.662Z"
    }
  },
  "Bauschi": {
    "numbers": [
      1,
      6,
      10,
      8,
      3
    ],
    "entryDate": {
      "$date": "2024-12-09T13:40:15.115Z"
    }
  },
  "Angi": {
    "numbers": [
      4,
      8,
      7,
      10,
      9
    ],
    "entryDate": {
      "$date": "2024-12-09T18:22:54.140Z"
    }
  }
},
{
  "_id": {
    "$oid": "6757e15f99600241382a152d"
  },
  "date": "10-12-2024",
  "winningNumbers": [
    9,
    1,
    10,
    5,
    3
  ],
  "createdAt": {
    "$date": "2024-12-10T06:36:15.121Z"
  },
  "Angi": {
    "numbers": [
      5,
      7,
      1,
      10,
      6
    ],
    "entryDate": {
      "$date": "2024-12-10T14:52:21.962Z"
    }
  }
},
{
  "_id": {
    "$oid": "67596df0cefa80032fe6285a"
  },
  "date": "11-12-2024",
  "winningNumbers": [
    4,
    10,
    5,
    8,
    6
  ],
  "createdAt": {
    "$date": "2024-12-11T10:48:16.974Z"
  },
  "Angi": {
    "numbers": [
      2,
      3,
      4,
      7,
      10
    ],
    "entryDate": {
      "$date": "2024-12-11T16:06:58.844Z"
    }
  }
},
{
  "_id": {
    "$oid": "675b066ccefa80032fe6285b"
  },
  "date": "12-12-2024",
  "winningNumbers": [
    6,
    8,
    1,
    10,
    3
  ],
  "createdAt": {
    "$date": "2024-12-12T15:51:08.495Z"
  },
  "Angi": {
    "numbers": [
      8,
      4,
      9,
      6,
      5
    ],
    "entryDate": {
      "$date": "2024-12-12T15:53:49.592Z"
    }
  },
  "Fcv": {
    "numbers": [
      2,
      9,
      7,
      8,
      4
    ],
    "entryDate": {
      "$date": "2024-12-12T19:55:53.228Z"
    }
  }
},
{
  "_id": {
    "$oid": "675bfd8f5b52be1983efa7c6"
  },
  "date": "13-12-2024",
  "winningNumbers": [
    10,
    8,
    2,
    6,
    4
  ],
  "createdAt": {
    "$date": "2024-12-13T09:25:35.593Z"
  },
  "Angi": {
    "numbers": [
      2,
      6,
      8,
      10,
      7
    ],
    "entryDate": {
      "$date": "2024-12-13T17:07:15.462Z"
    }
  }
},
{
  "_id": {
    "$oid": "675d49595b52be1983efa7c7"
  },
  "date": "14-12-2024",
  "winningNumbers": [
    10,
    7,
    5,
    9,
    1
  ],
  "createdAt": {
    "$date": "2024-12-14T09:01:13.561Z"
  },
  "Angi": {
    "numbers": [
      9,
      5,
      6,
      3,
      1
    ],
    "entryDate": {
      "$date": "2024-12-14T09:03:26.841Z"
    }
  },
  "Bauschi": {
    "numbers": [
      8,
      1,
      10,
      3,
      6
    ],
    "entryDate": {
      "$date": "2024-12-14T09:04:05.705Z"
    }
  }
},
{
  "_id": {
    "$oid": "675eaa1b5b52be1983efa7c8"
  },
  "date": "15-12-2024",
  "winningNumbers": [
    9,
    5,
    6,
    8,
    3
  ],
  "createdAt": {
    "$date": "2024-12-15T10:06:19.518Z"
  },
  "Angi": {
    "numbers": [
      1,
      5,
      4,
      9,
      7
    ],
    "entryDate": {
      "$date": "2024-12-15T12:55:55.544Z"
    }
  }
},
{
  "_id": {
    "$oid": "675ffceb5b52be1983efa7c9"
  },
  "date": "16-12-2024",
  "winningNumbers": [],
  "createdAt": {
    "$date": "2024-12-16T10:11:55.023Z"
  }
},
{
  "_id": {
    "$oid": "6761a4585b52be1983efa7ca"
  },
  "date": "17-12-2024",
  "winningNumbers": [
    6,
    4,
    9,
    5,
    10
  ],
  "createdAt": {
    "$date": "2024-12-17T16:18:32.875Z"
  },
  "Angi": {
    "numbers": [
      2,
      7,
      9,
      5,
      4
    ],
    "entryDate": {
      "$date": "2024-12-17T16:19:09.746Z"
    }
  }
},
{
  "_id": {
    "$oid": "676294aa5b52be1983efa7cb"
  },
  "date": "18-12-2024",
  "winningNumbers": [
    7,
    4,
    2,
    6,
    1
  ],
  "createdAt": {
    "$date": "2024-12-18T09:23:54.526Z"
  },
  "Angi": {
    "numbers": [
      6,
      4,
      9,
      2,
      10
    ],
    "entryDate": {
      "$date": "2024-12-18T14:10:02.202Z"
    }
  }
},
{
  "_id": {
    "$oid": "676425a9d717bbe24c4f9113"
  },
  "date": "19-12-2024",
  "winningNumbers": [
    3,
    2,
    6,
    9,
    5
  ],
  "createdAt": {
    "$date": "2024-12-19T13:54:49.263Z"
  },
  "Angi": {
    "numbers": [
      4,
      2,
      5,
      10,
      1
    ],
    "entryDate": {
      "$date": "2024-12-19T13:56:19.614Z"
    }
  }
},
{
  "_id": {
    "$oid": "676589c31a41bbf3425e5bc0"
  },
  "date": "20-12-2024",
  "winningNumbers": [
    1,
    10,
    8,
    7,
    6
  ],
  "createdAt": {
    "$date": "2024-12-20T15:14:11.317Z"
  },
  "Angi": {
    "numbers": [
      1,
      10,
      5,
      6,
      3
    ],
    "entryDate": {
      "$date": "2024-12-20T15:14:30.394Z"
    }
  }
},
{
  "_id": {
    "$oid": "676677d7d95b8605deb3ed6c"
  },
  "date": "21-12-2024",
  "winningNumbers": [
    6,
    4,
    8,
    5,
    1
  ],
  "createdAt": {
    "$date": "2024-12-21T08:09:59.468Z"
  },
  "Angi": {
    "numbers": [
      7,
      3,
      4,
      10,
      2
    ],
    "entryDate": {
      "$date": "2024-12-21T16:33:05.286Z"
    }
  }
},
{
  "_id": {
    "$oid": "6768412fd95b8605deb3ed6d"
  },
  "date": "22-12-2024",
  "winningNumbers": [
    2,
    4,
    8,
    1,
    9
  ],
  "createdAt": {
    "$date": "2024-12-22T16:41:19.368Z"
  },
  "Angi": {
    "numbers": [
      5,
      8,
      6,
      3,
      2
    ],
    "entryDate": {
      "$date": "2024-12-22T16:41:31.153Z"
    }
  }
},
{
  "_id": {
    "$oid": "67698aa2d95b8605deb3ed6e"
  },
  "date": "23-12-2024",
  "winningNumbers": [
    7,
    9,
    1,
    4,
    10
  ],
  "createdAt": {
    "$date": "2024-12-23T16:06:58.988Z"
  },
  "Angi": {
    "numbers": [
      7,
      3,
      9,
      2,
      5
    ],
    "entryDate": {
      "$date": "2024-12-23T16:08:26.461Z"
    }
  }
},
{
  "_id": {
    "$oid": "676c8879d95b8605deb3ed6f"
  },
  "date": "25-12-2024",
  "winningNumbers": [
    5,
    9,
    6,
    1,
    4
  ],
  "createdAt": {
    "$date": "2024-12-25T22:34:33.040Z"
  }
}]